<?xml version="1.0"?>
<!--
Click nbfs://nbhost/SystemFileSystem/Templates/Licenses/license-default.txt to change this license
Click nbfs://nbhost/SystemFileSystem/Templates/XML/XmlSchema.xsd to edit this template
-->

<xs:schema version="1.0"
           xmlns:xs="http://www.w3.org/2001/XMLSchema"
           elementFormDefault="qualified">
    
    <xs:element name="company">
        <xs:complexType>
            <xs:sequence>
                <xs:element name="project" minOccurs="0" maxOccurs="unbounded"/>
            </xs:sequence>
        </xs:complexType>
    </xs:element>
    
    <xs:element name="project">
        <xs:complexType>
            <xs:sequence>
                <xs:element name="name" type="xs:string"/>
                <xs:element name="language" type="xs:string"/>
                <xs:element name="sprint" minOccurs="0" maxOccurs="unbounded"/>
            </xs:sequence>
            <xs:attribute name="id" type="xs:string"/>
        </xs:complexType>
    </xs:element>
    
    <xs:element name="sprint">
        <xs:complexType>
            <xs:sequence>
                <xs:element name="name" type="xs:string"/>
                <xs:element name="duration" type="xs:string"/>
                <xs:element name="task" minOccurs="0" maxOccurs="unbounded"/>
            </xs:sequence>
            <xs:attribute name="id" type="xs:string"/>
        </xs:complexType>        
    </xs:element>
    
    <xs:element name="task">
        <xs:complexType>
            <xs:sequence>
                <xs:element name="name" type="xs:string"/>
                <xs:element name="duration" type="xs:string"/>
                <xs:element name="status" type="xs:string"/>
                <xs:element name="manager"/>
                <xs:element name="employee" minOccurs="0" maxOccurs="unbounded"/>
            </xs:sequence>
            <xs:attribute name="id" type="xs:string"/>
        </xs:complexType>       
    </xs:element>
    
    <xs:element name="manager">
        <xs:complexType>
            <xs:sequence>
                <xs:element name="name" type="xs:string"/>
                <xs:element name="deparment"/>
            </xs:sequence>
            <xs:attribute name="id" type="xs:string"/>
        </xs:complexType>
    </xs:element>
    
    <xs:element name="employee">
        <xs:complexType>
            <xs:sequence>
                <xs:element name="name" type="xs:string"/>
                <xs:element name="deparment"/>
            </xs:sequence>
            <xs:attribute name="id" type="xs:string"/>
        </xs:complexType>
    </xs:element>
    
    <xs:element name="deparment">
        <xs:complexType>
            <xs:sequence>
                <xs:element name="name" type="xs:string"/>
            </xs:sequence>
            <xs:attribute name="id" type="xs:string"/>
        </xs:complexType>
    </xs:element>
    
</xs:schema>
